[
  {
    "id": "sovereign.ward-that-lied",
    "version": 1,
    "title": "The Ward That Lied",
    "availability": "faction",
    "factionIds": ["sovereign_sect"],
    "levelMin": 1,
    "levelMax": 20,
    "mode": "solo_story",
    "prerequisiteQuestIds": [],
    "objectives": [
      {
        "id": "sovereign.ward-that-lied.obj1",
        "description": "Investigate the failed ward-engine",
        "targetCount": 1,
        "optional": false
      },
      {
        "id": "sovereign.ward-that-lied.obj2",
        "description": "Recover the missing jade seal",
        "targetCount": 1,
        "optional": false
      },
      {
        "id": "sovereign.ward-that-lied.obj3",
        "description": "Enter the Underterrace Archive",
        "targetCount": 1,
        "optional": false
      },
      {
        "id": "sovereign.ward-that-lied.obj4",
        "description": "Present verified evidence to the inquiry",
        "targetCount": 1,
        "optional": false
      }
    ],
    "rewardTableId": "rewards.sovereign.ward_that_lied",
    "choiceFlagIds": ["sovereign.archive_disposition"],
    "essentialProgression": false
  },
  {
    "id": "ashen.shard-that-sang",
    "version": 1,
    "title": "The Shard That Sang",
    "availability": "faction",
    "factionIds": ["ashen_syndicate"],
    "levelMin": 1,
    "levelMax": 20,
    "mode": "solo_story",
    "prerequisiteQuestIds": [],
    "objectives": [
      {
        "id": "ashen.shard-that-sang.obj1",
        "description": "Secure the living Zodiac scale",
        "targetCount": 1,
        "optional": false
      },
      {
        "id": "ashen.shard-that-sang.obj2",
        "description": "Rescue workers from the failing extraction rig",
        "targetCount": 1,
        "optional": false
      },
      {
        "id": "ashen.shard-that-sang.obj3",
        "description": "Enter the Cinder Vault",
        "targetCount": 1,
        "optional": false
      },
      {
        "id": "ashen.shard-that-sang.obj4",
        "description": "Submit evidence to the workers\u0027 council",
        "targetCount": 1,
        "optional": false
      }
    ],
    "rewardTableId": "rewards.ashen.shard_that_sang",
    "choiceFlagIds": ["ashen.site_future"],
    "essentialProgression": false
  },
  {
    "id": "concord.forest-that-remembered",
    "version": 1,
    "title": "The Forest That Remembered",
    "availability": "faction",
    "factionIds": ["astral_concord"],
    "levelMin": 1,
    "levelMax": 20,
    "mode": "solo_story",
    "prerequisiteQuestIds": [],
    "objectives": [
      {
        "id": "concord.forest-that-remembered.obj1",
        "description": "Follow the spirit-beast\u0027s memory trail",
        "targetCount": 1,
        "optional": false
      },
      {
        "id": "concord.forest-that-remembered.obj2",
        "description": "Stabilise the river shrine",
        "targetCount": 1,
        "optional": false
      },
      {
        "id": "concord.forest-that-remembered.obj3",
        "description": "Enter the Drowned Shrine",
        "targetCount": 1,
        "optional": false
      },
      {
        "id": "concord.forest-that-remembered.obj4",
        "description": "Establish consent for the new rite",
        "targetCount": 1,
        "optional": false
      }
    ],
    "rewardTableId": "rewards.concord.forest_that_remembered",
    "choiceFlagIds": ["concord.ritual_consent"],
    "essentialProgression": false
  },
  {
    "id": "sovereign.names-we-sealed",
    "version": 1,
    "title": "The Names We Sealed",
    "availability": "faction",
    "factionIds": ["sovereign_sect"],
    "levelMin": 5,
    "levelMax": 10,
    "mode": "solo_side",
    "prerequisiteQuestIds": [],
    "objectives": [
      {
        "id": "sovereign.names-we-sealed.obj1",
        "description": "Recover the evacuation ledger tablets",
        "targetCount": 1,
        "optional": false
      },
      {
        "id": "sovereign.names-we-sealed.obj2",
        "description": "Find the families named in the ledger",
        "targetCount": 1,
        "optional": false
      },
      {
        "id": "sovereign.names-we-sealed.obj3",
        "description": "Deliver verified memorial records",
        "targetCount": 1,
        "optional": false
      }
    ],
    "rewardTableId": "rewards.sovereign.names_we_sealed",
    "choiceFlagIds": ["sovereign.ledger_publication"],
    "essentialProgression": false
  },
  {
    "id": "sovereign.price-quiet-street",
    "version": 1,
    "title": "The Price of a Quiet Street",
    "availability": "faction",
    "factionIds": ["sovereign_sect"],
    "levelMin": 8,
    "levelMax": 14,
    "mode": "solo_side",
    "prerequisiteQuestIds": [],
    "objectives": [
      {
        "id": "sovereign.price-quiet-street.obj1",
        "description": "Interview three households",
        "targetCount": 1,
        "optional": false
      },
      {
        "id": "sovereign.price-quiet-street.obj2",
        "description": "Inspect confiscated relics",
        "targetCount": 1,
        "optional": false
      },
      {
        "id": "sovereign.price-quiet-street.obj3",
        "description": "Propose a transparent inspection process",
        "targetCount": 1,
        "optional": false
      }
    ],
    "rewardTableId": "rewards.sovereign.price_quiet_street",
    "choiceFlagIds": ["sovereign.relic_policy"],
    "essentialProgression": false
  },
  {
    "id": "sovereign.sword-unarmed",
    "version": 1,
    "title": "A Sword for the Unarmed",
    "availability": "faction",
    "factionIds": ["sovereign_sect"],
    "levelMin": 12,
    "levelMax": 18,
    "mode": "solo_side",
    "prerequisiteQuestIds": [],
    "objectives": [
      {
        "id": "sovereign.sword-unarmed.obj1",
        "description": "Train the neighbourhood volunteers",
        "targetCount": 1,
        "optional": false
      },
      {
        "id": "sovereign.sword-unarmed.obj2",
        "description": "Defend the supply convoy",
        "targetCount": 1,
        "optional": false
      },
      {
        "id": "sovereign.sword-unarmed.obj3",
        "description": "Establish a community protection charter",
        "targetCount": 1,
        "optional": false
      }
    ],
    "rewardTableId": "rewards.sovereign.sword_unarmed",
    "choiceFlagIds": ["sovereign.community_defence"],
    "essentialProgression": false
  },
  {
    "id": "sovereign.unsent-letters",
    "version": 1,
    "title": "The Marshal\u0027s Unsent Letters",
    "availability": "faction",
    "factionIds": ["sovereign_sect"],
    "levelMin": 16,
    "levelMax": 20,
    "mode": "solo_side",
    "prerequisiteQuestIds": [],
    "objectives": [
      {
        "id": "sovereign.unsent-letters.obj1",
        "description": "Track the missing courier",
        "targetCount": 1,
        "optional": false
      },
      {
        "id": "sovereign.unsent-letters.obj2",
        "description": "Recover the sealed letters",
        "targetCount": 1,
        "optional": false
      },
      {
        "id": "sovereign.unsent-letters.obj3",
        "description": "Deliver the letters to the affected families",
        "targetCount": 1,
        "optional": false
      }
    ],
    "rewardTableId": "rewards.sovereign.unsent_letters",
    "choiceFlagIds": ["sovereign.letters_disposition"],
    "essentialProgression": false
  },
  {
    "id": "ashen.last-shift",
    "version": 1,
    "title": "The Last Shift",
    "availability": "faction",
    "factionIds": ["ashen_syndicate"],
    "levelMin": 5,
    "levelMax": 10,
    "mode": "solo_side",
    "prerequisiteQuestIds": [],
    "objectives": [
      {
        "id": "ashen.last-shift.obj1",
        "description": "Stabilise the extraction gate",
        "targetCount": 1,
        "optional": false
      },
      {
        "id": "ashen.last-shift.obj2",
        "description": "Rescue trapped workers",
        "targetCount": 1,
        "optional": false
      },
      {
        "id": "ashen.last-shift.obj3",
        "description": "Document unsafe extraction orders",
        "targetCount": 1,
        "optional": false
      }
    ],
    "rewardTableId": "rewards.ashen.last_shift",
    "choiceFlagIds": ["ashen.evidence_release"],
    "essentialProgression": false
  },
  {
    "id": "ashen.market-memories",
    "version": 1,
    "title": "A Market for Stolen Memories",
    "availability": "faction",
    "factionIds": ["ashen_syndicate"],
    "levelMin": 8,
    "levelMax": 14,
    "mode": "solo_side",
    "prerequisiteQuestIds": [],
    "objectives": [
      {
        "id": "ashen.market-memories.obj1",
        "description": "Trace the memory-fragment buyer",
        "targetCount": 1,
        "optional": false
      },
      {
        "id": "ashen.market-memories.obj2",
        "description": "Identify fragments taken without consent",
        "targetCount": 1,
        "optional": false
      },
      {
        "id": "ashen.market-memories.obj3",
        "description": "Recover the dangerous fragment",
        "targetCount": 1,
        "optional": false
      }
    ],
    "rewardTableId": "rewards.ashen.market_memories",
    "choiceFlagIds": ["ashen.memory_market"],
    "essentialProgression": false
  },
  {
    "id": "ashen.free-hand",
    "version": 1,
    "title": "The Price of a Free Hand",
    "availability": "faction",
    "factionIds": ["ashen_syndicate"],
    "levelMin": 12,
    "levelMax": 18,
    "mode": "solo_side",
    "prerequisiteQuestIds": [],
    "objectives": [
      {
        "id": "ashen.free-hand.obj1",
        "description": "Investigate the protection fee",
        "targetCount": 1,
        "optional": false
      },
      {
        "id": "ashen.free-hand.obj2",
        "description": "Defend the community workshop",
        "targetCount": 1,
        "optional": false
      },
      {
        "id": "ashen.free-hand.obj3",
        "description": "Negotiate a public charter",
        "targetCount": 1,
        "optional": false
      }
    ],